{
  "$schema": "https://json-schema.org/draft/2020-12/schema",
  "$id": "solarrooftop/contracts/A.schema.json",
  "title": "Contract A — RoofJob (P3 creates, P2 fetch fills imagery, P1 + P2 read)",
  "description": "One assessment job. The api Lambda creates job_id/lat/lng/address; P2's fetch step adds the imagery fields and writes the completed document to s3://<jobs-bucket>/jobs/{job_id}/job_A.json. Defined in the 'Shared team contract' section of the P*.md briefs.",
  "type": "object",
  "required": ["job_id", "lat", "lng", "image_s3_uri", "image_bounds", "gsd_m", "imagery_source"],
  "properties": {
    "job_id": {"type": "string", "minLength": 1},
    "lat": {"type": "number", "minimum": -90, "maximum": 90},
    "lng": {"type": "number", "minimum": -180, "maximum": 180},
    "address": {"type": ["string", "null"]},
    "image_s3_uri": {
      "type": "string", "minLength": 1,
      "description": "RGB tile for P1's model: 512x512 px, centred on (lat, lng), PNG or TIFF. s3://<bucket>/jobs/{job_id}/rgb.png in AWS; a repo-relative path in contracts/fixtures."
    },
    "image_bounds": {
      "type": "array", "minItems": 4, "maxItems": 4,
      "description": "[minLng, minLat, maxLng, maxLat] of the tile, WGS84.",
      "prefixItems": [
        {"type": "number", "minimum": -180, "maximum": 180},
        {"type": "number", "minimum": -90, "maximum": 90},
        {"type": "number", "minimum": -180, "maximum": 180},
        {"type": "number", "minimum": -90, "maximum": 90}
      ]
    },
    "gsd_m": {"type": "number", "exclusiveMinimum": 0, "description": "Metres per pixel of the tile."},
    "dsm_s3_uri": {"type": ["string", "null"], "description": "Height raster if Google Solar provided one, else null."},
    "footprint": {
      "description": "Target building footprint (WGS84). Strongly recommended: without it P1 caps the roof to 12 m around the point.",
      "oneOf": [{"type": "null"}, {"$ref": "#/$defs/polygon"}]
    },
    "imagery_source": {"enum": ["google_solar", "esri", "upload"]}
  },
  "$defs": {
    "position": {
      "type": "array", "minItems": 2, "maxItems": 2,
      "prefixItems": [
        {"type": "number", "minimum": -180, "maximum": 180},
        {"type": "number", "minimum": -90, "maximum": 90}
      ]
    },
    "polygon": {
      "type": "object",
      "required": ["type", "coordinates"],
      "properties": {
        "type": {"const": "Polygon"},
        "coordinates": {
          "type": "array", "minItems": 1,
          "items": {"type": "array", "minItems": 4, "items": {"$ref": "#/$defs/position"}}
        }
      }
    }
  }
}
